1 2021-02-05 17:49:24.099555 3.123.217.208 → 192.168.10.168 TLSv1.2 122 Application Data
2 2021-02-05 17:49:24.099634 192.168.10.168 → 3.123.217.208 TCP 66 50411 → 443 [ACK] Seq=1 Ack=57 Win=2047 Len=0 TSval=531143635 TSecr=162647324
3 2021-02-05 17:49:24.383688 192.168.10.168 → 192.168.10.1 DNS 97 Standard query 0xf2b9 AAAA global.vortex.data.trafficmanager.net
4 2021-02-05 17:49:24.418892 192.168.10.1 → 192.168.10.168 DNS 153 Standard query response 0xf2b9 AAAA global.vortex.data.trafficmanager.net SOA tm1.msft.net
5 2021-02-05 17:49:24.420066 192.168.10.168 → 40.77.226.250 TCP 78 62543 → 443 [SYN] Seq=0 Win=65535 Len=0 MSS=1460 WS=64 TSval=531143954 TSecr=0 SACK_PERM=1
6 2021-02-05 17:49:24.464533 40.77.226.250 → 192.168.10.168 TCP 66 443 → 62543 [SYN, ACK] Seq=0 Ack=1 Win=65535 Len=0 MSS=1440 WS=256 SACK_PERM=1
7 2021-02-05 17:49:24.464677 192.168.10.168 → 40.77.226.250 TCP 54 62543 → 443 [ACK] Seq=1 Ack=1 Win=262144 Len=0
8 2021-02-05 17:49:24.465007 192.168.10.168 → 40.77.226.250 TLSv1 571 Client Hello
9 2021-02-05 17:49:24.511192 40.77.226.250 → 192.168.10.168 TCP 1514 [TCP segment of a reassembled PDU]
10 2021-02-05 17:49:24.511226 40.77.226.250 → 192.168.10.168 TCP 1514 443 → 62543 [ACK] Seq=1461 Ack=518 Win=525056 Len=1460 [TCP segment of a reassembled PDU]
11 2021-02-05 17:49:24.511230 40.77.226.250 → 192.168.10.168 TLSv1.2 900 Server Hello, Certificate, Server Key Exchange, Server Hello Done
12 2021-02-05 17:49:24.511381 192.168.10.168 → 40.77.226.250 TCP 54 62543 → 443 [ACK] Seq=518 Ack=2921 Win=259200 Len=0
13 2021-02-05 17:49:24.511423 192.168.10.168 → 40.77.226.250 TCP 54 62543 → 443 [ACK] Seq=518 Ack=3767 Win=258368 Len=0
14 2021-02-05 17:49:24.511602 192.168.10.168 → 40.77.226.250 TCP 54 [TCP Window Update] 62543 → 443 [ACK] Seq=518 Ack=3767 Win=262144 Len=0
15 2021-02-05 17:49:24.513185 192.168.10.168 → 40.77.226.250 TLSv1.2 147 Client Key Exchange, Change Cipher Spec, Encrypted Handshake Message
16 2021-02-05 17:49:24.557039 40.77.226.250 → 192.168.10.168 TLSv1.2 105 Change Cipher Spec, Encrypted Handshake Message
17 2021-02-05 17:49:24.557175 192.168.10.168 → 40.77.226.250 TCP 54 62543 → 443 [ACK] Seq=611 Ack=3818 Win=262080 Len=0
18 2021-02-05 17:49:24.558964 192.168.10.168 → 40.77.226.250 TCP 1494 [TCP segment of a reassembled PDU]
19 2021-02-05 17:49:24.558965 192.168.10.168 → 40.77.226.250 TLSv1.2 251 Application Data
20 2021-02-05 17:49:24.601660 40.77.226.250 → 192.168.10.168 TCP 60 443 → 62543 [ACK] Seq=3818 Ack=2248 Win=525568 Len=0
21 2021-02-05 17:49:24.627106 40.77.226.250 → 192.168.10.168 TLSv1.2 368 Application Data
22 2021-02-05 17:49:24.627239 192.168.10.168 → 40.77.226.250 TCP 54 62543 → 443 [ACK] Seq=2248 Ack=4133 Win=261824 Len=0
23 2021-02-05 17:49:24.628086 192.168.10.168 → 40.77.226.250 TLSv1.2 85 Encrypted Alert
24 2021-02-05 17:49:24.628271 192.168.10.168 → 40.77.226.250 TCP 54 62543 → 443 [FIN, ACK] Seq=2279 Ack=4133 Win=262144 Len=0
25 2021-02-05 17:49:24.670920 40.77.226.250 → 192.168.10.168 TCP 60 443 → 62543 [ACK] Seq=4133 Ack=2280 Win=525568 Len=0
26 2021-02-05 17:49:24.672987 192.168.10.168 → 192.168.10.1 DNS 93 Standard query 0x518f AAAA cache-bma1625.hosts.secretcdn.net
27 2021-02-05 17:49:24.679281 192.168.10.1 → 192.168.10.168 DNS 155 Standard query response 0x518f AAAA cache-bma1625.hosts.secretcdn.net SOA ns1.p04.dynect.net
28 2021-02-05 17:49:24.680091 192.168.10.168 → 157.52.95.25 TCP 78 62544 → 443 [SYN] Seq=0 Win=65535 Len=0 MSS=1460 WS=64 TSval=531144208 TSecr=0 SACK_PERM=1
29 2021-02-05 17:49:24.684911 157.52.95.25 → 192.168.10.168 TCP 74 443 → 62544 [SYN, ACK] Seq=0 Ack=1 Win=65535 Len=0 MSS=1440 SACK_PERM=1 TSval=1695292285 TSecr=531144208 WS=512
30 2021-02-05 17:49:24.684962 192.168.10.168 → 157.52.95.25 TCP 66 62544 → 443 [ACK] Seq=1 Ack=1 Win=131328 Len=0 TSval=531144212 TSecr=1695292285
31 2021-02-05 17:49:24.686948 192.168.10.168 → 157.52.95.25 TLSv1 583 Client Hello
32 2021-02-05 17:49:24.691230 157.52.95.25 → 192.168.10.168 TCP 66 443 → 62544 [ACK] Seq=1 Ack=518 Win=67072 Len=0 TSval=1695292291 TSecr=531144213
33 2021-02-05 17:49:24.695895 157.52.95.25 → 192.168.10.168 TLSv1.2 1494 Server Hello
34 2021-02-05 17:49:24.695900 157.52.95.25 → 192.168.10.168 TCP 1494 443 → 62544 [ACK] Seq=1429 Ack=518 Win=67072 Len=1428 TSval=1695292296 TSecr=531144213 [TCP segment of a reassembled PDU]
35 2021-02-05 17:49:24.695902 157.52.95.25 → 192.168.10.168 TLSv1.2 602 Certificate, Server Key Exchange, Server Hello Done
36 2021-02-05 17:49:24.696001 192.168.10.168 → 157.52.95.25 TCP 66 62544 → 443 [ACK] Seq=518 Ack=2857 Win=128512 Len=0 TSval=531144221 TSecr=1695292296
37 2021-02-05 17:49:24.696001 192.168.10.168 → 157.52.95.25 TCP 66 62544 → 443 [ACK] Seq=518 Ack=3393 Win=127936 Len=0 TSval=531144221 TSecr=1695292296
38 2021-02-05 17:49:24.696773 192.168.10.168 → 157.52.95.25 TCP 66 [TCP Window Update] 62544 → 443 [ACK] Seq=518 Ack=3393 Win=131008 Len=0 TSval=531144221 TSecr=1695292296
39 2021-02-05 17:49:24.697550 192.168.10.168 → 157.52.95.25 TLSv1.2 159 Client Key Exchange, Change Cipher Spec, Encrypted Handshake Message
40 2021-02-05 17:49:24.703223 157.52.95.25 → 192.168.10.168 TLSv1.2 340 New Session Ticket, Change Cipher Spec, Encrypted Handshake Message
41 2021-02-05 17:49:24.703296 192.168.10.168 → 157.52.95.25 TCP 66 62544 → 443 [ACK] Seq=611 Ack=3667 Win=130752 Len=0 TSval=531144228 TSecr=1695292303
42 2021-02-05 17:49:24.703782 192.168.10.168 → 157.52.95.25 TLSv1.2 298 Application Data
43 2021-02-05 17:49:24.712205 157.52.95.25 → 192.168.10.168 TLSv1.2 234 Application Data, Application Data
44 2021-02-05 17:49:24.712412 192.168.10.168 → 157.52.95.25 TCP 66 62544 → 443 [ACK] Seq=843 Ack=3835 Win=130880 Len=0 TSval=531144237 TSecr=1695292312
45 2021-02-05 17:49:24.817460 192.168.10.168 → 157.52.95.25 TCP 78 62545 → 443 [SYN] Seq=0 Win=65535 Len=0 MSS=1460 WS=64 TSval=531144340 TSecr=0 SACK_PERM=1
46 2021-02-05 17:49:24.821749 157.52.95.25 → 192.168.10.168 TCP 74 443 → 62545 [SYN, ACK] Seq=0 Ack=1 Win=65535 Len=0 MSS=1440 SACK_PERM=1 TSval=1695292422 TSecr=531144340 WS=512
47 2021-02-05 17:49:24.821795 192.168.10.168 → 157.52.95.25 TCP 66 62545 → 443 [ACK] Seq=1 Ack=1 Win=131328 Len=0 TSval=531144344 TSecr=1695292422
48 2021-02-05 17:49:24.822297 192.168.10.168 → 157.52.95.25 TLSv1 583 Client Hello
49 2021-02-05 17:49:24.826921 157.52.95.25 → 192.168.10.168 TCP 66 443 → 62545 [ACK] Seq=1 Ack=518 Win=67072 Len=0 TSval=1695292427 TSecr=531144344
50 2021-02-05 17:49:24.829436 157.52.95.25 → 192.168.10.168 TLSv1.2 1494 Server Hello
51 2021-02-05 17:49:24.829438 157.52.95.25 → 192.168.10.168 TCP 1494 443 → 62545 [ACK] Seq=1429 Ack=518 Win=67072 Len=1428 TSval=1695292429 TSecr=531144344 [TCP segment of a reassembled PDU]
52 2021-02-05 17:49:24.829438 157.52.95.25 → 192.168.10.168 TLSv1.2 602 Certificate, Server Key Exchange, Server Hello Done
53 2021-02-05 17:49:24.829477 192.168.10.168 → 157.52.95.25 TCP 66 62545 → 443 [ACK] Seq=518 Ack=2857 Win=128512 Len=0 TSval=531144351 TSecr=1695292429
54 2021-02-05 17:49:24.829493 192.168.10.168 → 157.52.95.25 TCP 66 62545 → 443 [ACK] Seq=518 Ack=3393 Win=127936 Len=0 TSval=531144351 TSecr=1695292429
55 2021-02-05 17:49:24.829720 192.168.10.168 → 157.52.95.25 TCP 66 [TCP Window Update] 62545 → 443 [ACK] Seq=518 Ack=3393 Win=131008 Len=0 TSval=531144351 TSecr=1695292429
56 2021-02-05 17:49:24.829949 192.168.10.168 → 157.52.95.25 TLSv1.2 159 Client Key Exchange, Change Cipher Spec, Encrypted Handshake Message
57 2021-02-05 17:49:24.834935 157.52.95.25 → 192.168.10.168 TLSv1.2 340 New Session Ticket, Change Cipher Spec, Encrypted Handshake Message
58 2021-02-05 17:49:24.834967 192.168.10.168 → 157.52.95.25 TCP 66 62545 → 443 [ACK] Seq=611 Ack=3667 Win=130752 Len=0 TSval=531144356 TSecr=1695292435
59 2021-02-05 17:49:24.835373 192.168.10.168 → 157.52.95.25 TLSv1.2 298 Application Data
60 2021-02-05 17:49:24.846747 157.52.95.25 → 192.168.10.168 TLSv1.2 234 Application Data, Application Data
61 2021-02-05 17:49:24.846783 192.168.10.168 → 157.52.95.25 TCP 66 62545 → 443 [ACK] Seq=843 Ack=3835 Win=130880 Len=0 TSval=531144367 TSecr=1695292447
62 2021-02-05 17:49:24.847365 192.168.10.168 → 157.52.95.25 TCP 66 62544 → 443 [FIN, ACK] Seq=843 Ack=3835 Win=131072 Len=0 TSval=531144367 TSecr=1695292312
63 2021-02-05 17:49:24.852337 157.52.95.25 → 192.168.10.168 TLSv1.2 97 Encrypted Alert
64 2021-02-05 17:49:24.852339 157.52.95.25 → 192.168.10.168 TCP 66 443 → 62544 [FIN, ACK] Seq=3866 Ack=844 Win=68096 Len=0 TSval=1695292452 TSecr=531144367
65 2021-02-05 17:49:24.852381 192.168.10.168 → 157.52.95.25 TCP 54 62544 → 443 [RST] Seq=844 Win=0 Len=0
66 2021-02-05 17:49:24.852382 192.168.10.168 → 157.52.95.25 TCP 54 62544 → 443 [RST] Seq=844 Win=0 Len=0
67 2021-02-05 17:49:24.951942 192.168.10.168 → 157.52.95.25 TCP 78 62546 → 443 [SYN] Seq=0 Win=65535 Len=0 MSS=1460 WS=64 TSval=531144471 TSecr=0 SACK_PERM=1
68 2021-02-05 17:49:24.956345 157.52.95.25 → 192.168.10.168 TCP 74 443 → 62546 [SYN, ACK] Seq=0 Ack=1 Win=65535 Len=0 MSS=1440 SACK_PERM=1 TSval=1695292556 TSecr=531144471 WS=512
69 2021-02-05 17:49:24.956402 192.168.10.168 → 157.52.95.25 TCP 66 62546 → 443 [ACK] Seq=1 Ack=1 Win=131328 Len=0 TSval=531144475 TSecr=1695292556
70 2021-02-05 17:49:24.956933 192.168.10.168 → 157.52.95.25 TLSv1 583 Client Hello
71 2021-02-05 17:49:24.962744 157.52.95.25 → 192.168.10.168 TCP 66 443 → 62546 [ACK] Seq=1 Ack=518 Win=67072 Len=0 TSval=1695292563 TSecr=531144475
72 2021-02-05 17:49:24.965452 157.52.95.25 → 192.168.10.168 TLSv1.2 1494 Server Hello
73 2021-02-05 17:49:24.965456 157.52.95.25 → 192.168.10.168 TCP 1494 443 → 62546 [ACK] Seq=1429 Ack=518 Win=67072 Len=1428 TSval=1695292565 TSecr=531144475 [TCP segment of a reassembled PDU]
74 2021-02-05 17:49:24.965457 157.52.95.25 → 192.168.10.168 TLSv1.2 602 Certificate, Server Key Exchange, Server Hello Done
75 2021-02-05 17:49:24.965521 192.168.10.168 → 157.52.95.25 TCP 66 62546 → 443 [ACK] Seq=518 Ack=2857 Win=128512 Len=0 TSval=531144483 TSecr=1695292565
76 2021-02-05 17:49:24.965521 192.168.10.168 → 157.52.95.25 TCP 66 62546 → 443 [ACK] Seq=518 Ack=3393 Win=127936 Len=0 TSval=531144483 TSecr=1695292565
77 2021-02-05 17:49:24.965836 192.168.10.168 → 157.52.95.25 TCP 66 [TCP Window Update] 62546 → 443 [ACK] Seq=518 Ack=3393 Win=131008 Len=0 TSval=531144483 TSecr=1695292565
78 2021-02-05 17:49:24.966172 192.168.10.168 → 157.52.95.25 TLSv1.2 159 Client Key Exchange, Change Cipher Spec, Encrypted Handshake Message
79 2021-02-05 17:49:24.972565 157.52.95.25 → 192.168.10.168 TLSv1.2 340 New Session Ticket, Change Cipher Spec, Encrypted Handshake Message
80 2021-02-05 17:49:24.972621 192.168.10.168 → 157.52.95.25 TCP 66 62546 → 443 [ACK] Seq=611 Ack=3667 Win=130752 Len=0 TSval=531144490 TSecr=1695292572
81 2021-02-05 17:49:24.972902 192.168.10.168 → 157.52.95.25 TLSv1.2 298 Application Data
82 2021-02-05 17:49:24.982538 157.52.95.25 → 192.168.10.168 TLSv1.2 234 Application Data, Application Data
83 2021-02-05 17:49:24.982596 192.168.10.168 → 157.52.95.25 TCP 66 62546 → 443 [ACK] Seq=843 Ack=3835 Win=130880 Len=0 TSval=531144499 TSecr=1695292583
84 2021-02-05 17:49:24.984198 192.168.10.168 → 157.52.95.25 TCP 66 62545 → 443 [FIN, ACK] Seq=843 Ack=3835 Win=131072 Len=0 TSval=531144500 TSecr=1695292447
85 2021-02-05 17:49:24.991232 157.52.95.25 → 192.168.10.168 TLSv1.2 97 Encrypted Alert
86 2021-02-05 17:49:24.991235 157.52.95.25 → 192.168.10.168 TCP 66 443 → 62545 [FIN, ACK] Seq=3866 Ack=844 Win=68096 Len=0 TSval=1695292591 TSecr=531144500
87 2021-02-05 17:49:24.991352 192.168.10.168 → 157.52.95.25 TCP 54 62545 → 443 [RST] Seq=844 Win=0 Len=0
88 2021-02-05 17:49:24.991353 192.168.10.168 → 157.52.95.25 TCP 54 62545 → 443 [RST] Seq=844 Win=0 Len=0
89 2021-02-05 17:49:25.092555 192.168.10.168 → 157.52.95.25 TCP 78 62547 → 443 [SYN] Seq=0 Win=65535 Len=0 MSS=1460 WS=64 TSval=531144607 TSecr=0 SACK_PERM=1
90 2021-02-05 17:49:25.097726 157.52.95.25 → 192.168.10.168 TCP 74 443 → 62547 [SYN, ACK] Seq=0 Ack=1 Win=65535 Len=0 MSS=1440 SACK_PERM=1 TSval=1695292697 TSecr=531144607 WS=512
91 2021-02-05 17:49:25.097792 192.168.10.168 → 157.52.95.25 TCP 66 62547 → 443 [ACK] Seq=1 Ack=1 Win=131328 Len=0 TSval=531144612 TSecr=1695292697
92 2021-02-05 17:49:25.098508 192.168.10.168 → 157.52.95.25 TLSv1 583 Client Hello
93 2021-02-05 17:49:25.103733 157.52.95.25 → 192.168.10.168 TCP 66 443 → 62547 [ACK] Seq=1 Ack=518 Win=67072 Len=0 TSval=1695292703 TSecr=531144612
94 2021-02-05 17:49:25.107112 157.52.95.25 → 192.168.10.168 TLSv1.2 1494 Server Hello
95 2021-02-05 17:49:25.107114 157.52.95.25 → 192.168.10.168 TCP 1494 443 → 62547 [ACK] Seq=1429 Ack=518 Win=67072 Len=1428 TSval=1695292706 TSecr=531144612 [TCP segment of a reassembled PDU]
96 2021-02-05 17:49:25.107114 157.52.95.25 → 192.168.10.168 TLSv1.2 602 Certificate, Server Key Exchange, Server Hello Done
97 2021-02-05 17:49:25.107166 192.168.10.168 → 157.52.95.25 TCP 66 62547 → 443 [ACK] Seq=518 Ack=2857 Win=128512 Len=0 TSval=531144620 TSecr=1695292706
98 2021-02-05 17:49:25.107166 192.168.10.168 → 157.52.95.25 TCP 66 62547 → 443 [ACK] Seq=518 Ack=3393 Win=127936 Len=0 TSval=531144620 TSecr=1695292706
99 2021-02-05 17:49:25.107446 192.168.10.168 → 157.52.95.25 TCP 66 [TCP Window Update] 62547 → 443 [ACK] Seq=518 Ack=3393 Win=131008 Len=0 TSval=531144620 TSecr=1695292706
100 2021-02-05 17:49:25.107700 192.168.10.168 → 157.52.95.25 TLSv1.2 159 Client Key Exchange, Change Cipher Spec, Encrypted Handshake Message
101 2021-02-05 17:49:25.115122 157.52.95.25 → 192.168.10.168 TLSv1.2 340 New Session Ticket, Change Cipher Spec, Encrypted Handshake Message
102 2021-02-05 17:49:25.115179 192.168.10.168 → 157.52.95.25 TCP 66 62547 → 443 [ACK] Seq=611 Ack=3667 Win=130752 Len=0 TSval=531144628 TSecr=1695292715
103 2021-02-05 17:49:25.115421 192.168.10.168 → 157.52.95.25 TLSv1.2 298 Application Data
104 2021-02-05 17:49:25.127665 157.52.95.25 → 192.168.10.168 TLSv1.2 234 Application Data, Application Data
105 2021-02-05 17:49:25.127812 192.168.10.168 → 157.52.95.25 TCP 66 62547 → 443 [ACK] Seq=843 Ack=3835 Win=130880 Len=0 TSval=531144640 TSecr=1695292727
106 2021-02-05 17:49:25.129313 192.168.10.168 → 157.52.95.25 TCP 66 62546 → 443 [FIN, ACK] Seq=843 Ack=3835 Win=131072 Len=0 TSval=531144641 TSecr=1695292583
107 2021-02-05 17:49:25.133577 157.52.95.25 → 192.168.10.168 TLSv1.2 97 Encrypted Alert
108 2021-02-05 17:49:25.133581 157.52.95.25 → 192.168.10.168 TCP 66 443 → 62546 [FIN, ACK] Seq=3866 Ack=844 Win=68096 Len=0 TSval=1695292734 TSecr=531144641
109 2021-02-05 17:49:25.133657 192.168.10.168 → 157.52.95.25 TCP 54 62546 → 443 [RST] Seq=844 Win=0 Len=0
110 2021-02-05 17:49:25.133658 192.168.10.168 → 157.52.95.25 TCP 54 62546 → 443 [RST] Seq=844 Win=0 Len=0
111 2021-02-05 17:49:25.238868 192.168.10.168 → 157.52.95.25 TCP 78 62548 → 443 [SYN] Seq=0 Win=65535 Len=0 MSS=1460 WS=64 TSval=531144749 TSecr=0 SACK_PERM=1
112 2021-02-05 17:49:25.243292 157.52.95.25 → 192.168.10.168 TCP 74 443 → 62548 [SYN, ACK] Seq=0 Ack=1 Win=65535 Len=0 MSS=1440 SACK_PERM=1 TSval=1695292843 TSecr=531144749 WS=512
113 2021-02-05 17:49:25.243428 192.168.10.168 → 157.52.95.25 TCP 66 62548 → 443 [ACK] Seq=1 Ack=1 Win=131328 Len=0 TSval=531144753 TSecr=1695292843
114 2021-02-05 17:49:25.244800 192.168.10.168 → 157.52.95.25 TLSv1 583 Client Hello
115 2021-02-05 17:49:25.248990 157.52.95.25 → 192.168.10.168 TCP 66 443 → 62548 [ACK] Seq=1 Ack=518 Win=67072 Len=0 TSval=1695292849 TSecr=531144754
116 2021-02-05 17:49:25.252450 157.52.95.25 → 192.168.10.168 TLSv1.2 1494 Server Hello
117 2021-02-05 17:49:25.252453 157.52.95.25 → 192.168.10.168 TCP 1494 443 → 62548 [ACK] Seq=1429 Ack=518 Win=67072 Len=1428 TSval=1695292852 TSecr=531144754 [TCP segment of a reassembled PDU]
118 2021-02-05 17:49:25.252454 157.52.95.25 → 192.168.10.168 TLSv1.2 602 Certificate, Server Key Exchange, Server Hello Done
119 2021-02-05 17:49:25.252520 192.168.10.168 → 157.52.95.25 TCP 66 62548 → 443 [ACK] Seq=518 Ack=2857 Win=128512 Len=0 TSval=531144761 TSecr=1695292852
120 2021-02-05 17:49:25.252520 192.168.10.168 → 157.52.95.25 TCP 66 62548 → 443 [ACK] Seq=518 Ack=3393 Win=127936 Len=0 TSval=531144761 TSecr=1695292852
121 2021-02-05 17:49:25.252857 192.168.10.168 → 157.52.95.25 TCP 66 [TCP Window Update] 62548 → 443 [ACK] Seq=518 Ack=3393 Win=131008 Len=0 TSval=531144761 TSecr=1695292852
122 2021-02-05 17:49:25.253235 192.168.10.168 → 157.52.95.25 TLSv1.2 159 Client Key Exchange, Change Cipher Spec, Encrypted Handshake Message
123 2021-02-05 17:49:25.259562 157.52.95.25 → 192.168.10.168 TLSv1.2 340 New Session Ticket, Change Cipher Spec, Encrypted Handshake Message
124 2021-02-05 17:49:25.259612 192.168.10.168 → 157.52.95.25 TCP 66 62548 → 443 [ACK] Seq=611 Ack=3667 Win=130752 Len=0 TSval=531144768 TSecr=1695292860
125 2021-02-05 17:49:25.259919 192.168.10.168 → 157.52.95.25 TLSv1.2 298 Application Data
126 2021-02-05 17:49:25.271933 157.52.95.25 → 192.168.10.168 TLSv1.2 234 Application Data, Application Data
127 2021-02-05 17:49:25.271990 192.168.10.168 → 157.52.95.25 TCP 66 62548 → 443 [ACK] Seq=843 Ack=3835 Win=130880 Len=0 TSval=531144780 TSecr=1695292871
128 2021-02-05 17:49:25.272596 192.168.10.168 → 157.52.95.25 TCP 66 62547 → 443 [FIN, ACK] Seq=843 Ack=3835 Win=131072 Len=0 TSval=531144780 TSecr=1695292727
129 2021-02-05 17:49:25.280793 157.52.95.25 → 192.168.10.168 TLSv1.2 97 Encrypted Alert
130 2021-02-05 17:49:25.280796 157.52.95.25 → 192.168.10.168 TCP 66 443 → 62547 [FIN, ACK] Seq=3866 Ack=844 Win=68096 Len=0 TSval=1695292880 TSecr=531144780
131 2021-02-05 17:49:25.280862 192.168.10.168 → 157.52.95.25 TCP 54 62547 → 443 [RST] Seq=844 Win=0 Len=0
132 2021-02-05 17:49:25.280862 192.168.10.168 → 157.52.95.25 TCP 54 62547 → 443 [RST] Seq=844 Win=0 Len=0
133 2021-02-05 17:49:25.381712 192.168.10.168 → 157.52.95.25 TCP 78 62549 → 443 [SYN] Seq=0 Win=65535 Len=0 MSS=1460 WS=64 TSval=531144887 TSecr=0 SACK_PERM=1
134 2021-02-05 17:49:25.386978 157.52.95.25 → 192.168.10.168 TCP 74 443 → 62549 [SYN, ACK] Seq=0 Ack=1 Win=65535 Len=0 MSS=1440 SACK_PERM=1 TSval=1695292987 TSecr=531144887 WS=512
135 2021-02-05 17:49:25.387034 192.168.10.168 → 157.52.95.25 TCP 66 62549 → 443 [ACK] Seq=1 Ack=1 Win=131328 Len=0 TSval=531144892 TSecr=1695292987
136 2021-02-05 17:49:25.387592 192.168.10.168 → 157.52.95.25 TLSv1 583 Client Hello
137 2021-02-05 17:49:25.392948 157.52.95.25 → 192.168.10.168 TCP 66 443 → 62549 [ACK] Seq=1 Ack=518 Win=67072 Len=0 TSval=1695292993 TSecr=531144892
138 2021-02-05 17:49:25.396264 157.52.95.25 → 192.168.10.168 TLSv1.2 1494 Server Hello
139 2021-02-05 17:49:25.396267 157.52.95.25 → 192.168.10.168 TCP 1494 443 → 62549 [ACK] Seq=1429 Ack=518 Win=67072 Len=1428 TSval=1695292996 TSecr=531144892 [TCP segment of a reassembled PDU]
140 2021-02-05 17:49:25.396267 157.52.95.25 → 192.168.10.168 TLSv1.2 602 Certificate, Server Key Exchange, Server Hello Done
141 2021-02-05 17:49:25.396332 192.168.10.168 → 157.52.95.25 TCP 66 62549 → 443 [ACK] Seq=518 Ack=2857 Win=128512 Len=0 TSval=531144900 TSecr=1695292996
142 2021-02-05 17:49:25.396363 192.168.10.168 → 157.52.95.25 TCP 66 62549 → 443 [ACK] Seq=518 Ack=3393 Win=127936 Len=0 TSval=531144900 TSecr=1695292996
143 2021-02-05 17:49:25.396581 192.168.10.168 → 157.52.95.25 TCP 66 [TCP Window Update] 62549 → 443 [ACK] Seq=518 Ack=3393 Win=131008 Len=0 TSval=531144900 TSecr=1695292996
144 2021-02-05 17:49:25.396841 192.168.10.168 → 157.52.95.25 TLSv1.2 159 Client Key Exchange, Change Cipher Spec, Encrypted Handshake Message
145 2021-02-05 17:49:25.401971 157.52.95.25 → 192.168.10.168 TLSv1.2 340 New Session Ticket, Change Cipher Spec, Encrypted Handshake Message
146 2021-02-05 17:49:25.402022 192.168.10.168 → 157.52.95.25 TCP 66 62549 → 443 [ACK] Seq=611 Ack=3667 Win=130752 Len=0 TSval=531144905 TSecr=1695293002
147 2021-02-05 17:49:25.402263 192.168.10.168 → 157.52.95.25 TLSv1.2 298 Application Data
148 2021-02-05 17:49:25.410016 157.52.95.25 → 192.168.10.168 TLSv1.2 234 Application Data, Application Data
149 2021-02-05 17:49:25.410065 192.168.10.168 → 157.52.95.25 TCP 66 62549 → 443 [ACK] Seq=843 Ack=3835 Win=130880 Len=0 TSval=531144912 TSecr=1695293010
150 2021-02-05 17:49:25.410832 192.168.10.168 → 157.52.95.25 TCP 66 62548 → 443 [FIN, ACK] Seq=843 Ack=3835 Win=131072 Len=0 TSval=531144912 TSecr=1695292871
151 2021-02-05 17:49:25.416509 157.52.95.25 → 192.168.10.168 TLSv1.2 97 Encrypted Alert
152 2021-02-05 17:49:25.416512 157.52.95.25 → 192.168.10.168 TCP 66 443 → 62548 [FIN, ACK] Seq=3866 Ack=844 Win=68096 Len=0 TSval=1695293017 TSecr=531144912
153 2021-02-05 17:49:25.416583 192.168.10.168 → 157.52.95.25 TCP 54 62548 → 443 [RST] Seq=844 Win=0 Len=0
154 2021-02-05 17:49:25.416583 192.168.10.168 → 157.52.95.25 TCP 54 62548 → 443 [RST] Seq=844 Win=0 Len=0
155 2021-02-05 17:49:25.495510 192.168.10.168 → 46.166.161.185 TLSv1.2 602 Application Data
156 2021-02-05 17:49:25.512957 46.166.161.185 → 192.168.10.168 TCP 66 443 → 50685 [ACK] Seq=1 Ack=537 Win=501 Len=0 TSval=2525296989 TSecr=531144996
157 2021-02-05 17:49:25.516941 192.168.10.168 → 157.52.95.25 TCP 78 62550 → 443 [SYN] Seq=0 Win=65535 Len=0 MSS=1460 WS=64 TSval=531145016 TSecr=0 SACK_PERM=1
158 2021-02-05 17:49:25.521604 157.52.95.25 → 192.168.10.168 TCP 74 443 → 62550 [SYN, ACK] Seq=0 Ack=1 Win=65535 Len=0 MSS=1440 SACK_PERM=1 TSval=1695293121 TSecr=531145016 WS=512
159 2021-02-05 17:49:25.521653 192.168.10.168 → 157.52.95.25 TCP 66 62550 → 443 [ACK] Seq=1 Ack=1 Win=131328 Len=0 TSval=531145020 TSecr=1695293121
160 2021-02-05 17:49:25.522380 192.168.10.168 → 157.52.95.25 TLSv1 583 Client Hello
161 2021-02-05 17:49:25.526949 157.52.95.25 → 192.168.10.168 TCP 66 443 → 62550 [ACK] Seq=1 Ack=518 Win=67072 Len=0 TSval=1695293127 TSecr=531145020
162 2021-02-05 17:49:25.530093 157.52.95.25 → 192.168.10.168 TLSv1.2 1494 Server Hello
163 2021-02-05 17:49:25.530099 157.52.95.25 → 192.168.10.168 TCP 1494 443 → 62550 [ACK] Seq=1429 Ack=518 Win=67072 Len=1428 TSval=1695293130 TSecr=531145020 [TCP segment of a reassembled PDU]
164 2021-02-05 17:49:25.530101 157.52.95.25 → 192.168.10.168 TLSv1.2 602 Certificate, Server Key Exchange, Server Hello Done
165 2021-02-05 17:49:25.530252 192.168.10.168 → 157.52.95.25 TCP 66 62550 → 443 [ACK] Seq=518 Ack=2857 Win=128512 Len=0 TSval=531145028 TSecr=1695293130
166 2021-02-05 17:49:25.530252 192.168.10.168 → 157.52.95.25 TCP 66 62550 → 443 [ACK] Seq=518 Ack=3393 Win=127936 Len=0 TSval=531145028 TSecr=1695293130
167 2021-02-05 17:49:25.530905 192.168.10.168 → 157.52.95.25 TCP 66 [TCP Window Update] 62550 → 443 [ACK] Seq=518 Ack=3393 Win=131008 Len=0 TSval=531145028 TSecr=1695293130
168 2021-02-05 17:49:25.531623 192.168.10.168 → 157.52.95.25 TLSv1.2 159 Client Key Exchange, Change Cipher Spec, Encrypted Handshake Message
169 2021-02-05 17:49:25.537586 157.52.95.25 → 192.168.10.168 TLSv1.2 340 New Session Ticket, Change Cipher Spec, Encrypted Handshake Message
170 2021-02-05 17:49:25.537648 192.168.10.168 → 157.52.95.25 TCP 66 62550 → 443 [ACK] Seq=611 Ack=3667 Win=130752 Len=0 TSval=531145035 TSecr=1695293137
171 2021-02-05 17:49:25.538006 192.168.10.168 → 157.52.95.25 TLSv1.2 298 Application Data
172 2021-02-05 17:49:25.548383 157.52.95.25 → 192.168.10.168 TLSv1.2 234 Application Data, Application Data
173 2021-02-05 17:49:25.548440 192.168.10.168 → 157.52.95.25 TCP 66 62550 → 443 [ACK] Seq=843 Ack=3835 Win=130880 Len=0 TSval=531145045 TSecr=1695293148
174 2021-02-05 17:49:25.549141 192.168.10.168 → 157.52.95.25 TCP 66 62549 → 443 [FIN, ACK] Seq=843 Ack=3835 Win=131072 Len=0 TSval=531145046 TSecr=1695293010
175 2021-02-05 17:49:25.557048 157.52.95.25 → 192.168.10.168 TLSv1.2 97 Encrypted Alert
176 2021-02-05 17:49:25.557050 157.52.95.25 → 192.168.10.168 TCP 66 443 → 62549 [FIN, ACK] Seq=3866 Ack=844 Win=68096 Len=0 TSval=1695293157 TSecr=531145046
177 2021-02-05 17:49:25.557113 192.168.10.168 → 157.52.95.25 TCP 54 62549 → 443 [RST] Seq=844 Win=0 Len=0
178 2021-02-05 17:49:25.557114 192.168.10.168 → 157.52.95.25 TCP 54 62549 → 443 [RST] Seq=844 Win=0 Len=0
179 2021-02-05 17:49:25.649472 192.168.10.168 → 192.168.10.247 TCP 176 50272 → 8009 [PSH, ACK] Seq=1 Ack=1 Win=2048 Len=110 TSval=531145145 TSecr=4961713 [TCP segment of a reassembled PDU]
180 2021-02-05 17:49:25.654750 192.168.10.168 → 157.52.95.25 TCP 78 62551 → 443 [SYN] Seq=0 Win=65535 Len=0 MSS=1460 WS=64 TSval=531145150 TSecr=0 SACK_PERM=1
181 2021-02-05 17:49:25.659747 157.52.95.25 → 192.168.10.168 TCP 74 443 → 62551 [SYN, ACK] Seq=0 Ack=1 Win=65535 Len=0 MSS=1440 SACK_PERM=1 TSval=1695293259 TSecr=531145150 WS=512
182 2021-02-05 17:49:25.659878 192.168.10.168 → 157.52.95.25 TCP 66 62551 → 443 [ACK] Seq=1 Ack=1 Win=131328 Len=0 TSval=531145155 TSecr=1695293259
183 2021-02-05 17:49:25.661344 192.168.10.168 → 157.52.95.25 TLSv1 583 Client Hello
184 2021-02-05 17:49:25.666293 192.168.10.247 → 192.168.10.168 TCP 176 8009 → 50272 [PSH, ACK] Seq=1 Ack=111 Win=310 Len=110 TSval=4962215 TSecr=531145145 [TCP segment of a reassembled PDU]
185 2021-02-05 17:49:25.666300 157.52.95.25 → 192.168.10.168 TCP 66 443 → 62551 [ACK] Seq=1 Ack=518 Win=67072 Len=0 TSval=1695293266 TSecr=531145156
186 2021-02-05 17:49:25.666443 192.168.10.168 → 192.168.10.247 TCP 66 50272 → 8009 [ACK] Seq=111 Ack=111 Win=2046 Len=0 TSval=531145161 TSecr=4962215
187 2021-02-05 17:49:25.668698 157.52.95.25 → 192.168.10.168 TLSv1.2 1494 Server Hello
188 2021-02-05 17:49:25.668703 157.52.95.25 → 192.168.10.168 TCP 1494 443 → 62551 [ACK] Seq=1429 Ack=518 Win=67072 Len=1428 TSval=1695293268 TSecr=531145156 [TCP segment of a reassembled PDU]
189 2021-02-05 17:49:25.668704 157.52.95.25 → 192.168.10.168 TLSv1.2 602 Certificate, Server Key Exchange, Server Hello Done
190 2021-02-05 17:49:25.668780 192.168.10.168 → 157.52.95.25 TCP 66 62551 → 443 [ACK] Seq=518 Ack=2857 Win=128512 Len=0 TSval=531145163 TSecr=1695293268
191 2021-02-05 17:49:25.668781 192.168.10.168 → 157.52.95.25 TCP 66 62551 → 443 [ACK] Seq=518 Ack=3393 Win=127936 Len=0 TSval=531145163 TSecr=1695293268
192 2021-02-05 17:49:25.669235 192.168.10.168 → 157.52.95.25 TCP 66 [TCP Window Update] 62551 → 443 [ACK] Seq=518 Ack=3393 Win=131008 Len=0 TSval=531145163 TSecr=1695293268
193 2021-02-05 17:49:25.669708 192.168.10.168 → 157.52.95.25 TLSv1.2 159 Client Key Exchange, Change Cipher Spec, Encrypted Handshake Message
194 2021-02-05 17:49:25.674592 157.52.95.25 → 192.168.10.168 TLSv1.2 340 New Session Ticket, Change Cipher Spec, Encrypted Handshake Message
195 2021-02-05 17:49:25.674637 192.168.10.168 → 157.52.95.25 TCP 66 62551 → 443 [ACK] Seq=611 Ack=3667 Win=130752 Len=0 TSval=531145168 TSecr=1695293274
196 2021-02-05 17:49:25.674923 192.168.10.168 → 157.52.95.25 TLSv1.2 298 Application Data
197 2021-02-05 17:49:25.684227 157.52.95.25 → 192.168.10.168 TLSv1.2 234 Application Data, Application Data
198 2021-02-05 17:49:25.684283 192.168.10.168 → 157.52.95.25 TCP 66 62551 → 443 [ACK] Seq=843 Ack=3835 Win=130880 Len=0 TSval=531145177 TSecr=1695293284
199 2021-02-05 17:49:25.684990 192.168.10.168 → 157.52.95.25 TCP 66 62550 → 443 [FIN, ACK] Seq=843 Ack=3835 Win=131072 Len=0 TSval=531145177 TSecr=1695293148
200 2021-02-05 17:49:25.691531 157.52.95.25 → 192.168.10.168 TLSv1.2 97 Encrypted Alert
201 2021-02-05 17:49:25.691534 157.52.95.25 → 192.168.10.168 TCP 66 443 → 62550 [FIN, ACK] Seq=3866 Ack=844 Win=68096 Len=0 TSval=1695293291 TSecr=531145177
202 2021-02-05 17:49:25.691614 192.168.10.168 → 157.52.95.25 TCP 54 62550 → 443 [RST] Seq=844 Win=0 Len=0
203 2021-02-05 17:49:25.691614 192.168.10.168 → 157.52.95.25 TCP 54 62550 → 443 [RST] Seq=844 Win=0 Len=0
204 2021-02-05 17:49:25.792019 192.168.10.168 → 157.52.95.25 TCP 78 62552 → 443 [SYN] Seq=0 Win=65535 Len=0 MSS=1460 WS=64 TSval=531145283 TSecr=0 SACK_PERM=1
205 2021-02-05 17:49:25.798224 157.52.95.25 → 192.168.10.168 TCP 74 443 → 62552 [SYN, ACK] Seq=0 Ack=1 Win=65535 Len=0 MSS=1440 SACK_PERM=1 TSval=1695293398 TSecr=531145283 WS=512
206 2021-02-05 17:49:25.798271 192.168.10.168 → 157.52.95.25 TCP 66 62552 → 443 [ACK] Seq=1 Ack=1 Win=131328 Len=0 TSval=531145289 TSecr=1695293398
207 2021-02-05 17:49:25.798738 192.168.10.168 → 157.52.95.25 TLSv1 583 Client Hello
208 2021-02-05 17:49:25.803209 157.52.95.25 → 192.168.10.168 TCP 66 443 → 62552 [ACK] Seq=1 Ack=518 Win=67072 Len=0 TSval=1695293403 TSecr=531145289
209 2021-02-05 17:49:25.805895 157.52.95.25 → 192.168.10.168 TLSv1.2 1494 Server Hello
210 2021-02-05 17:49:25.805896 157.52.95.25 → 192.168.10.168 TCP 1494 443 → 62552 [ACK] Seq=1429 Ack=518 Win=67072 Len=1428 TSval=1695293406 TSecr=531145289 [TCP segment of a reassembled PDU]
211 2021-02-05 17:49:25.805897 157.52.95.25 → 192.168.10.168 TLSv1.2 602 Certificate, Server Key Exchange, Server Hello Done
212 2021-02-05 17:49:25.805940 192.168.10.168 → 157.52.95.25 TCP 66 62552 → 443 [ACK] Seq=518 Ack=2857 Win=128512 Len=0 TSval=531145295 TSecr=1695293406
213 2021-02-05 17:49:25.805941 192.168.10.168 → 157.52.95.25 TCP 66 62552 → 443 [ACK] Seq=518 Ack=3393 Win=127936 Len=0 TSval=531145295 TSecr=1695293406
214 2021-02-05 17:49:25.806164 192.168.10.168 → 157.52.95.25 TCP 66 [TCP Window Update] 62552 → 443 [ACK] Seq=518 Ack=3393 Win=131008 Len=0 TSval=531145295 TSecr=1695293406
215 2021-02-05 17:49:25.806368 192.168.10.168 → 157.52.95.25 TLSv1.2 159 Client Key Exchange, Change Cipher Spec, Encrypted Handshake Message
216 2021-02-05 17:49:25.811798 157.52.95.25 → 192.168.10.168 TLSv1.2 340 New Session Ticket, Change Cipher Spec, Encrypted Handshake Message
217 2021-02-05 17:49:25.811830 192.168.10.168 → 157.52.95.25 TCP 66 62552 → 443 [ACK] Seq=611 Ack=3667 Win=130752 Len=0 TSval=531145300 TSecr=1695293412
218 2021-02-05 17:49:25.812079 192.168.10.168 → 157.52.95.25 TLSv1.2 298 Application Data
219 2021-02-05 17:49:25.820376 157.52.95.25 → 192.168.10.168 TLSv1.2 234 Application Data, Application Data
220 2021-02-05 17:49:25.820413 192.168.10.168 → 157.52.95.25 TCP 66 62552 → 443 [ACK] Seq=843 Ack=3835 Win=130880 Len=0 TSval=531145308 TSecr=1695293421
221 2021-02-05 17:49:25.820930 192.168.10.168 → 157.52.95.25 TCP 66 62551 → 443 [FIN, ACK] Seq=843 Ack=3835 Win=131072 Len=0 TSval=531145308 TSecr=1695293284
222 2021-02-05 17:49:25.837228 157.52.95.25 → 192.168.10.168 TLSv1.2 97 Encrypted Alert
223 2021-02-05 17:49:25.837230 157.52.95.25 → 192.168.10.168 TCP 66 443 → 62551 [FIN, ACK] Seq=3866 Ack=844 Win=68096 Len=0 TSval=1695293437 TSecr=531145308
224 2021-02-05 17:49:25.837277 192.168.10.168 → 157.52.95.25 TCP 54 62551 → 443 [RST] Seq=844 Win=0 Len=0
225 2021-02-05 17:49:25.837277 192.168.10.168 → 157.52.95.25 TCP 54 62551 → 443 [RST] Seq=844 Win=0 Len=0
226 2021-02-05 17:49:25.851214 130.237.28.53 → 192.168.10.168 TLSv1.2 83 Application Data
227 2021-02-05 17:49:25.851217 130.237.28.53 → 192.168.10.168 TCP 1514 [TCP segment of a reassembled PDU]
228 2021-02-05 17:49:25.851279 192.168.10.168 → 130.237.28.53 TCP 54 62489 → 443 [ACK] Seq=1 Ack=30 Win=4095 Len=0
229 2021-02-05 17:49:25.851311 130.237.28.53 → 192.168.10.168 TLSv1.2 1129 Application Data
230 2021-02-05 17:49:25.851345 192.168.10.168 → 130.237.28.53 TCP 54 62489 → 443 [ACK] Seq=1 Ack=2565 Win=4055 Len=0
231 2021-02-05 17:49:25.898746 192.168.10.168 → 192.168.10.1 DNS 74 Standard query 0x126f AAAA webmail.kth.se
232 2021-02-05 17:49:25.898997 192.168.10.168 → 192.168.10.1 DNS 74 Standard query 0x0daf A webmail.kth.SE
233 2021-02-05 17:49:25.899615 192.168.10.168 → 130.237.28.53 TCP 78 62553 → 443 [SYN] Seq=0 Win=65535 Len=0 MSS=1460 WS=64 TSval=531145385 TSecr=0 SACK_PERM=1
234 2021-02-05 17:49:25.903087 192.168.10.1 → 192.168.10.168 DNS 90 Standa